{
  "tenant_id": "3f0f4c1e-6a7b-4c2d-9e8f-0a1b2c3d4e5f",
  "application_id": "7c9e6679-7425-40de-944b-e07fc1f90ae7",
  "application_environment_id": "9b2e3c4d-5f60-4718-8a9b-0c1d2e3f4a5b",
  "application_environment_kind": "SANDBOX",
  "initiating_service_account_id": "1d2c3b4a-5e6f-4071-8293-a4b5c6d7e8f9",
  "initiating_principal_id": "5a6b7c8d-9e0f-4a1b-8c2d-3e4f5a6b7c8d"
}
